Id,Komentar,Rating
112641,"Memang benar, Anda melakukan lebih banyak pekerjaan daripada kelas teks dan ide lain (terutama jika melakukan tautan), tetapi, jika Anda tertarik sama sekali dalam materi, itu sepadan.Kuliahnya selalu menarik dan tergantung pada teks, kuat.Ujian bisa jadi sulit jika Anda tidak membaca/memperhatikan, dan makalah dinilai secara kritis (tapi pendek!).Sepadan!!!!",Sangat Baik
112641,Jangan ambil kelas apa pun yang dia ajarkan.Kata -kata tidak bisa menggambarkan ...,Buruk
112641,"Renzi adalah profasi yang solid dan tidak main -main.Buncau, final, dan esai akan baik bagi mereka yang membaca, dan mimpi buruk bagi mereka yang tidak.Saya mendapat A- tetapi saya membaca semuanya dan berpartisipasi dalam bacaan (yang diperhitungkan !!).Pergi ke kelas setiap minggu-dia memberikan kuis pop (jika orang tidak datang, dia memberi kuliah tentang bagaimana kita tidak menghargai pendidikan kita).",Cukup Baik
112641,"Renzi adalah profesor yang menuntut.Dia mengharapkan banyak, ada bacaan yang luas, dan kuliahnya mencakup beberapa materi yang sulit.Yang sedang berkata, saya merasa dia adalah profesor yang luar biasa.Saya menikmati semua kuliahnya dan mereka selalu membuat saya berpikir.Kertas pendeknya bisa dilakukan dan selama Anda menunjukkan proses pemikiran yang baik atau menarik, Anda akan baik -baik saja.",Baik
112641,"Seorang profesor yang tangguh terutama pada penilaian, tetapi kuliah itu sepadan.Kelas ini membantu saya memahami Nietzsche, Plato, Freud, Socrates, Kierkegaard, The Bible, dan St. Augustine dengan cara yang tidak akan pernah saya miliki sendiri.Dia memberikan kuis pop untuk memeriksa kehadiran, jadi pastikan Anda menghadiri setiap kelas.",awesome
112641,Harus dimasukkan dalam 10 jam seminggu hanya untuk kelas ini dan berakhir dengan A-.Bukan tidak mungkin untuk mendapatkan A seperti yang disebutkan oleh pengguna sebelumnya.Ini sangat sulit.Ambil kelas ini jika Anda tertarik pada filsafat dan ingin membaca literatur yang baik dan menghadiri kuliah yang menarik.Beban kerja sama intensnya dengan mendapatkan tahun pertama.,Baik
112641,"Jangan ambil kelas ini, terutama jika Anda tidak tertarik pada filsafat.Saya tidak pernah berjuang sebanyak yang saya lakukan di kelas ini, bacaan tidak membantu sama sekali.Menulis petunjuk untuk makalah dan ujian sangat kompleks dan sulit untuk mendapatkan nilai yang baik.Dia membuat kuliah menarik, tetapi saya tidak merasa dia sangat mudah didekati atau membantu.",Buruk
112641,"Dia adalah profesor yang luar biasa.Dia sangat jelas tentang apa yang dia inginkan.TA tidak berguna.D tengah semester (kesalahan saya) dan mendapat B di esai dan di final dan mendapat b+ di kelas.Tidak buruk mengingat saya mengambil jurusan Comp.sci/Engineering.BTW, mengambil Class Spring '11.",Sangat Baik
112641,"Antiquity & abad ke-19 terhubung- tidak, hanya saja tidak!Ini adalah pembunuh IPK dan dia adalah pria paling sombong yang pernah Anda temui.Dia sulit dan hanya ingin membuat hidup Anda sengsara.Selamatkan hidup Anda dan jangan ambil kelasnya!",Cukup Baik
112641,Jangan saya katakan jangan ambil kelas ini.Anda akan menempatkan diri Anda melalui neraka jika Anda mengikuti kelas ini.Saya lebih suka tinggal di Antartika daripada mengambil kelas ini lagi.Anda telah diperingatkan !!,Buruk
112641,"Dia sangat pintar dan pasti tahu barang -barangnya, jadi pergilah ke semua kuliah dan dengarkan dengan saksama.Dia memiliki harapan yang tinggi dan semacam ****;Dia juga sangat penuh dengan dirinya sendiri.Tetapi pada akhirnya, dia brilian.Anda akan berjuang keras untuk b/b+, tetapi pasti bisa dilakukan.Namun, apa pun dalam kisaran praktis tidak mungkin.",Sangat Baik
112641,Dia adalah profesor yang sangat keras.Anda perlu melakukan semua bacaan yang sangat besar.Dia bisa menyinggung agama dan menakutkan.Dia adalah tipe agresif.Kuliah itu menarik tetapi kadang -kadang membosankan.TA tidak terlalu membantu sama sekali.,Cukup Baik
112641,"Kelas ini sulit dan cepat, tetapi Renzi tahu apa yang dia bicarakan & kuliah sangat menarik.Jumlah bacaan sulit dikelola pada waktu -waktu tertentu, nilai bagus sulit didapat, & tengah semester adalah salah satu tes tersulit yang saya miliki sejauh ini, tetapi saya merasa seperti saya benar -benar belajar dalam kursus ini.Berdoa untuk keajaiban kelas.",Baik
112641,"Sebelum mengambil kelas ini, saya diintimidasi oleh apa yang dikatakan orang lain.Tapi dia benar -benar tidak berarti dia sangat bersemangat tentang subjek ini.Saya pergi ke jam kerja untuk meminta bantuan dan dia sangat baik dan benar -benar banyak membantu saya.Jika Anda mengambil kelas ini, pastikan untuk menghadiri kuliah dari semua info yang diperlukan.disajikan di sana, keseluruhan kelas bagus",Baik
112641,"Conwest: Antiquity and 19th C.- Menulis intensif.Ini adalah kelas tipe kuliah dan tidak mengharapkan terlalu banyak interaksi dengan Renzi tetapi TA -nya sangat membantu.Ada banyak bacaan dan sebagian besar menarik.Sebelum tugas pertama ingatlah untuk menanyakan TA, dengan sangat khusus, apa yang mereka cari dalam tugas menulis.",Cukup Baik
112641,Besar,Sangat Baik
112641,"Kelas mengharuskan Anda untuk terus membaca karya -karya sulit yang benar -benar menantang bahkan yang paling berpendidikan.Namun, ia berpendapat dan tergelincir dalam pandangannya sendiri, sampai batas tertentu Anda dapat tidak setuju selama Anda memiliki argumen yang koheren.Kursus ini sangat sulit dan jika Anda mencari kursus yang mudah, ini bukan.Anda telah diperingatkan.",Cukup Baik
112641,dia sangat pintar ... sombong ya tapi kuliahnya tidak bisa disangkal menarik,Cukup Baik
112641,"Saya ingat datang di RatemyProfessor tepat sebelum pendaftaran musim semi, dan komentar yang saya lihat mengatakan jangan lakukan itu.Tetapi pada saat saya harus mendaftar, saya terjebak dengan Renzi.Dan setelah semester penuh dari egoisnya, merendahkan & quot; mengajar & quot;Saya ulangi jangan lakukan itu !!",Buruk
112641,Sungguh seharusnya mendengarkan pria 4 komentar itu ketika saya memeriksa ini.,Buruk
112641,"Dia sombong dan terobsesi dengan dirinya sendiri.Jika Anda mengajukan pertanyaan kepadanya, dia segera menyerang Anda.Di sisi lain, Anda benar -benar tidak perlu membaca atau mengerjakan pekerjaan rumah selain beberapa makalah.Nilai Anda pada dasarnya didasarkan pada apakah TA Anda adalah siswa kelas yang ketat atau tidak.",Buruk
112641,"Renzi, sebagai pribadi, sangat menarik dan meyakinkan dengan presentasinya tentang teks -teks yang dibaca.Namun, sikapnya yang memikat terhadap teks -teks menyisakan sedikit atau tidak ada ruang untuk interpretasi atau pendapat.Singkatnya, kelas ini tidak sepadan dengan waktu atau energi.",Buruk
112641,"Profesor Renzi sendiri adalah pria yang sangat menarik.Saya melihat mengapa banyak orang memanggilnya sombong, tetapi bagi saya sepertinya lebih seperti dia memainkan Advokat Iblis.Masalahnya dengan Renzi adalah bahwa TAS melakukan semua penilaian dan sangat sulit untuk mengetahui apa, tepatnya, yang mereka cari.Ini akan menjadi kelas yang hebat jika dia memiliki TAS yang lebih baik.",Cukup Baik
112641,Jangan lakukan itu,Sangat Buruk
112641,"(Saya mengambil terkait dengan menulis esai) Subjeknya membosankan, dia tahu itu semua dengan hati yang mengesankan, tetapi siapa yang peduli.Dia membutuhkan TP untuk melupakan dirinya sendiri.TA saya tidak berbicara bahasa Inggris dan benar -benar memberi saya F pada satu halaman HW Tugas!Jangan ambil kelas Conwest -nya.",Buruk
112641,"Saya memiliki hubungan cinta/ benci dengan pria ini.Renzi sombong, tidak diragukan lagi, tapi saya pikir kelasnya melayani tujuannya dengan sempurna.Saya pikir ini adalah pengantar filsafat yang bagus.Saya menikmatinya, dan saya benar -benar tidak merasa terintimidasi sama sekali.Penilaiannya tidak sulit, terlepas dari apa yang dikatakan posting sebelumnya.Saya benar -benar tidak berusaha dan saya mendapat B di kursus.",Cukup Baik
112641,Sangat antusias,Cukup Baik
112641,Tidak ada komentar,Baik
112641,"Kuliah Renzi menarik dan jelas, tetapi TA -nya yang membuat kelas ini buruk.Mereka tidak hanya tidak tahu apa yang mereka bicarakan dalam bacaan, tetapi mereka juga sepenuhnya tidak membantu dan tidak adil dan tidak adil.Alih -alih memperkuat konten kuliah, TA mengajukan interpretasi mereka yang membingungkan, dan mengacaukan Anda di atas kertas.",Buruk
112641,"Dia profesor yang baik, ya.Tapi dia juga sama sekali tidak adil dan tidak bersyukur.Saya memiliki mono semester yang saya ambil kelasnya.Semua Prof saya yang lain bekerja dengan saya untuk mengejar pekerjaan yang terlewat, dll. Ketika saya sakit, tetapi Renzi mengecewakan saya untuk hadir !!Tidak masalah bahwa saya memiliki mono dan memiliki catatan dokter.Saya harus menarik diri atau dia bilang dia akan mengecewakan saya.",Cukup Baik
112641,"Satu ton membaca dan bekerja, tetapi orang ini adalah salah satu orang paling cerdas yang pernah saya temui.Dia kasar dan sombong, tapi dia tahu apa yang dia bicarakan.",Cukup Baik
112641,"Dalam keadaan apa pun Anda tidak boleh mengambil kelas ini saat ditautkan dengan menulis esai.Jangan lakukan itu.Dia pikir dia adalah profesor terpintar di dunia dan kuliahnya sangat menjengkelkan, tetapi saya bisa memicu semuanya tanpa membaca buku.",Sangat Buruk
112641,"Profesor Renzi mengintimidasi, namun tidak jahat.Kelasnya membuat Anda banyak berpikir dan sangat berpengaruh.Jika Anda tidak suka membaca, maka lupakan itu b/c ini bukan kelas percikan yang terkenal.Bahannya cukup padat, esp.Nietzsche.Renzi agak sombong, namun saya kira dia memiliki hak untuk menjadi b/c pria itu pasti tahu barang -barangnya.Dia pasti bisa mengajar!",Cukup Baik
112641,"Jangan khawatir Renzi, saya bukan salah satu dari Anda & quot; teman. & Quot;Memang, dia sangat cerdas dan pengetahuannya tentang klasik tidak dapat disangkal, kelasnya masih sulit.Tidak ada jumlah persiapan yang bisa membuat saya melampaui & quot; b & quot;tingkat.Saya merasa sebagian besar usaha saya sia -sia.Hindari kelas ini dengan segala cara.Dengan serius.Anda akan berterima kasih kepada saya nanti.",Buruk
112641,"Saya pikir Prof. Renzi benar -benar luar biasa.Dia mungkin sombong, tapi saya yakin dia berhak.Dia melakukan kuliahnya dengan luar biasa dan dia bahkan menghibur.Saya sangat menyukainya.Ini TA -nya, saya akan memperingatkan.Tapi pasti periksa HM.Dia fenomenal.",poor
112641,Tidak ada komentar,Buruk
112641,"Pintar dan sangat menarik, tapi agak sombong",Baik
112641,"Sungguh tusukan yang sombong!Menghina dan meremehkan.Dia mengajarkan kelasnya dengan intimidasi, dan dia berbicara omong kosong - omong kosong yang terdengar bagus dan halus yang tidak berarti apa -apa dan tidak memiliki tujuan, tetapi mengesankan.Saya mengasihani anak -anak yang ditarik olehnya.Hindari dia.",Buruk
112641,Profesor Renzi sangat pintar.Dia cukup menakutkan tetapi Anda akan belajar banyak di kelasnya.Ditambah ... dia seksi dengan cara Ed Harris.dua jempol ke atas.Anda akan belajar banyak dan dia memberikan pemandangan yang bagus.,Sangat Baik
112641,"Renzi adalah pria.Kuliahnya menawan dan benar -benar menerangi karya itu, penulis yang dimaksud.Pemahaman saya tentang Nietzsche dan Plato telah ditingkatkan olehnya.Sepertinya seseorang yang akan menulis filospi hebat yang ditandatangani sebagai Vincent Dionysus.Kecuali dia adalah seorang Platonis besar.Menjadi tinggi membantu dalam menulis makalah dan mendapatkan yang terbaik dari kuliahnya.",Sangat Baik
112641,"Saya pikir nama Nietszche akan selamanya membuat saya gempa di sepatu bot saya.Renzi tidak hormat dalam pendapatnya, tetapi sering membuat lelucon yang bagus.Saya harus memuji dia dalam memicu hasrat saya akan kebenaran di antara semua hal yang dia katakan.Saya belum menemukan banyak.Panggil dia jenius karena seperti Frues dia punya banyak siswa untuk mempercayai apa yang dia katakan tanpa fakta.",Buruk
112641,"Jangan ambil kelas ini jika Anda tidak ingin ditantang.The & quot; Preceptors & quot;alias TA ... terpaksa membagikan nilai buruk di atas kertas.Bacaan yang cukup diperlukan untuk bertahan seumur hidup.Meskipun menantang, saya harus mengatakan bahwa jika Anda berusaha, pikiran Anda pasti akan tumbuh dan berkembang ... seperti yang disukai Renzi.",Cukup Baik
112641,"Materi yang sulit, banyak membaca.Tapi sangat menarik.Renzi juga pria yang sangat pintar.Ambillah jika Anda menginginkan kelas yang menarik dan menantang.",Cukup Baik
112641,"Banyak orang mengatakan mereka tidak suka kelas/guru ini, tetapi saya benar -benar melakukannya.Kuliah kadang -kadang sulit diikuti karena topiknya sangat maju, tetapi saya memahaminya, saya merasa sangat terinspirasi/tercerahkan/semua hal yang baik.Renzi mengharapkan banyak tetapi dia guru yang baik, mengutarakan pikirannya, dan selalu tersedia untuk jam kantor.Saya akan mengatakan pergi untuk itu.",Baik
112641,"Renzi, pria itu, adalah pria yang sangat lucu.Renzi, sang profesor, menakutkan seperti ****.Saya mengambil Conwest terkait dengan menulis esai: kesalahan terbesar dari pengalaman NYU saya.Tugasnya tidak hanya sangat kabur, materi itu dijelaskan seolah -olah saya sudah baik -baik saja dengan polemik Nietzschian.Jujur, kelasnya tidak sepadan dengan waktu Anda",Buruk
112641,"Renzi adalah guru yang tangguh, dan kadang -kadang mengintimidasi.Kelas ini cukup sulit tetapi Renzi hanya ingin Anda benar -benar berpikir keras dan berusaha keras ke kelas.Dia merendahkan selama kuliah tetapi jika Anda masuk ke dia selama jam kantor dia benar -benar menghargai fakta bahwa Anda mencoba memahami teks dan memberi penghargaan kepada Anda.",Sangat Baik
112641,"Kelas Renzi luar biasa.Kuliahnya sangat bagus dan dia sangat lucu, jika Anda bisa mengerti apa yang dia bicarakan.Dia menantang hampir semua yang dikatakan setiap siswa di kelas, terutama jika itu bodoh.Buku -buku yang dia ajarkan sangat menarik dan dia tahu banyak tentang mereka.Dia tidak pernah mengajar dari catatan-dia tahu segalanya",Baik
112641,"Dia membuat kelas sangat sulit dan tidak perlu sulit.Penilaiannya sangat rendah (saya tidak kenal seseorang yang mendapat a), tugas-tugas.Pengajarannya menyebalkan karena tidak ada yang bisa mengerti apa yang dia katakan.Saya tidak tahu mengapa orang berpikir dia pintar ketika mereka tidak bisa mendapatkan kuliahnya!Hindari dia dengan cara apa pun!",Sangat Buruk
112641,brengsek lengkap.pecundang seorang profesor.menghindari.,Sangat Buruk
112641,"Renzi menakutkan beberapa hari pertama.Setelah itu, dia benar -benar mengintimidasi.Tapi tidak ada kerusakan nyata yang pernah dilakukan olehnya, dia tidak akan menggigit, dia hanya pembicara yang hebat.Jika Anda berjuang dengan pertanyaan filosofis, atau jika Anda setidaknya menganggap teks sebagai lebih dari sekadar tugas, Renzi akan ada untuk Anda.",Sangat Baik
112641,"Renzi tahu apa yang dia bicarakan, tetapi dia memberi tahu Anda.Dia pria yang sangat sombong & sombong.Jika Anda mengatakan sesuatu di kelas yang salah atau dia tidak setuju dengan dia akan menembak Anda dengan cara yang sangat merendahkan.Tapi, kuliahnya umumnya menarik.Tapi saya tidak berpikir itu menebus kesombongannya.",Cukup Baik
112641,"Begitu banyak yang ditipu olehnya & quot; cerdas & quot;tata krama.Saya tidak mengerti.Sejak kapan menakutkan membuat Anda tampak cerdas &#63;Ngomong -ngomong, kuliah Renzi benar -benar membosankan terlepas dari ketiaknya yang berkeringat, & quot; berbudaya & quot;Bloviating, dan kasar.Hitung menit jauhnya .... s..l..o..w..l..y ....",Buruk
112641,"Profesor Renzi adalah guru yang luar biasa, kuliahnya sangat menarik.Dia sedikit mengintimidasi jika Anda berbicara dengannya satu lawan satu, tetapi kuliahnya sangat bagus dan menyenangkan untuk dialami.Dia tidak merendahkan, dia hanya tahu banyak tentang studinya dan bersemangat tentang hal itu.Bersiaplah untuk membaca teks keras dan ditantang.",Baik
112641,Pria yang sangat kejam.,Sangat Buruk
112641,"Nah, terus terang, semua hype tentang Renzi menjadi **** benar -benar tidak berteleankan.Dia brengsek yang sombong, tapi, dia brengsek arogan yang cerdas.Pria itu punya banyak pengetahuan untuk dibagikan, jadi jika Anda bisa mengatasi sikapnya, maka Anda akan belajar banyak.Namun, ada profesor yang lebih mudah untuk kelas Con West;Sulit bahkan menarik A di kelas ini.",Buruk
112641,"Renzi brengsek.Dia benar -benar tidak membantu (jangan pergi ke jam kerja - dia tampaknya hidup untuk membuat Anda merasa seperti nitwit) dan menggurui secara tak tertahankan.Sejak hari pertama, dia menjelaskan secara eksplisit bahwa dia tidak tertarik pada pendapat, pikiran, atau perasaan yang muncul dari mulutnya sendiri.Semester yang benar -benar menyedihkan.",Sangat Buruk
112641,"Semua orang memberi Renzi omong kosong tentang menjadi 'sombong' dan 'tidak dapat diakses';Meskipun ada udara tertentu yang ia bawa, tidak diragukan lagi, Renzi akan sangat menantang Anda.Anda harus cukup bersama selama kuliah untuk mendapatkan semua apa yang terjadi, tetapi dia adalah dosen yang luar biasa dan dia menganggap pekerjaannya dengan serius sehubungan dengan dampaknya pada siswa.",Baik
112641,"Renzi jatuh cinta pada dirinya sendiri.Kuliahnya sangat menarik dan memprovokasi pikiran.Namun, saya menyadari setelah fakta, bahwa catatan kuliahnya mengikuti SparkNotes, hampir garis untuk garis.Penasaran...",Buruk
112641,"Instruktur yang mengerikan, idiot yang sombong dengan pakaian keriput dan ketiak yang terlalu aktif.Sangat membosankan, tidak lebih dari suara suaranya sendiri, meremehkan semua orang, benar-benar tidak dapat diakses, menilai mengerikan, mengintimidasi, kasar, dan berpikiran sempit.Apa lagi yang bisa dikatakan &#63;",Buruk
112641,"Renzi adalah pria yang tahu barang -barangnya.Kuliah sangat menarik, bahkan lucu, kadang -kadang.Dia selalu terbuka untuk mengambil pertanyaan selama kuliah, dan dia tidak & quot; sayang & quot;Siapa pun, jadi bersiaplah untuk banyak membaca dan sejumlah besar pekerjaan.Dia juga melihat melalui omong kosong, jadi bersiaplah untuk diskusi yang menyegarkan jika Anda mengajukan pertanyaan di kelas.",Baik
112641,"Renzi sulit, tetapi kelasnya sepadan.Dia membuat Anda memikirkan kembali segalanya.Satu -satunya masalah saya dengan kelas adalah kenyataan bahwa ia terlalu menafsirkan semua bacaan;dan hanya veiw -nya yang & quot; benar. & quot;",Cukup Baik
112641,"Kelas yang tangguh.Banyak membaca tegang.Nilai amibigus.Saya tidak pernah tahu apa yang harus ditanyakan selama kuliah.Kadang -kadang dia melemparkan komentar yang lucu dan berlaku, tetapi dia akan lebih baik tetap di departemen Yunani atau klasik yang dia bicarakan dengan sangat sayang.",Buruk
112641,"Profesor Renzi cerdas, tapi dia tahu itu.Dia tidak mengerti bahwa sebagian besar siswa tidak memiliki banyak pengetahuan di kelas sebelum mengambilnya.Para guru pembacaan cukup baik dan siswa kelas adil.Renzi menilai jangka menengah kami dengan sangat buruk.Misalnya 45 dari 64 poin yang mungkin harus menjadi C- (70%) tetapi ia membuat ini A D. Jangan ambil kelasnya!",average
112641,"Guru yang hebat, kelas ini banyak info untuk diproses, dan Renzi tidak dalam bisnis Babying siapa pun.Namun, kuliahnya selalu begitu pada titik sehingga saya akhirnya belajar dari catatan saya.Hal yang baik juga bahwa barang -barangnya menempel, dan dia mengingat Anda.Dia adalah salah satu guru paling cerdas dan terbaik yang pernah saya miliki di NYU.",Baik
112641,"Kecerdasan, humor, panasnya ... apa yang bisa saya katakan &#63;Kelas Renzi sangat menarik dan informatif.Seseorang dapat belajar banyak hanya dengan mendengarkan dia berbicara.Kelas ini menuntut banyak membaca dan konsentrasi.Anda tidak dapat melakukan apa pun, karena Renzi tampaknya tahu segalanya.Saya pasti mendorong semua untuk mengambil kelas Conwest -nya.",Sangat Baik
112641,"Renzi tangguh, tetapi sangat pandai dalam apa yang dia lakukan.",Baik
112641,"Renzi adalah **** yang tangguh, tidak ada pertanyaan tentang itu, tapi dia juga salah satu profesor paling cemerlang yang bisa Anda miliki ... atau setidaknya tampaknya seperti itu.Dia sombong dan dapat melakukan hal itu di mana dia tidak benar -benar menjawab pertanyaan Anda, hanya membingungkan Anda lebih banyak, tetapi jika Anda berusaha keras ke kelas, itu benar -benar bermanfaat.",Baik
112641,Bacaan yang sangat berat dan padat.Kuliah yang jelas dan informatif.Kelas yang sangat menuntut.Rekomendasikan melakukan penulisan tautan esai untuk menyimpan bacaan.,Baik
112641,"Dia sombong, menjengkelkan, sok, sarkastik dan terlalu pintar untuk kebaikannya sendiri-saya menyukai kelasnya.Itu adalah satu -satunya yang saya nantikan/tidak tertidur. Bidang tengahnya sulit, tetapi final adalah gimme.Ini lebih mudah daripada kuis pop -nya.",Baik
112641,"Dia tahu banyak bahwa dia lupa bahwa murid -muridnya tidak semua memiliki latar belakang filsafat yang sama.Saya berharap saya bisa belajar lebih banyak, tetapi saya terlalu sibuk hanya mencoba mengikat semuanya untuk membuatnya berarti apa -apa.",Sangat Buruk
112641,"Renzi adalah seorang profesor yang mengerikan, babi yang kasar, menjengkelkan, tidak membantu, sombong.Hindari dia seperti wabah.Dia terlalu sibuk menyembah kecerdasannya sendiri untuk digunakan di luar waktu kuliah.",Buruk
112641,"Dia merendahkan, sombong, dan kejam hanya untuk itu.Semua sama, saya belajar banyak di kelasnya.",Baik
112641,"Renzi adalah profesor khas Anda yang sombong.Kelasnya hanya menarik karena dia sangat braniac.Nona sebuah kelas, meskipun - datanglah kepadanya dengan masalah, dan dia pasti akan membuat Anda merasa seperti idiot.Waspadai, juga, bahwa kelas ini adalah jalan resmi NYU untuk retorika anti-Kristen yang diperlukan.",Cukup Baik
112641,Sungguh pria botak seksi yang luar biasa pintar.Dia membuat pergi ke kelas hampir sama menyenangkannya dengan penembakan di Brooklyn Bar lokal.,Sangat Baik
112641,"Saya benci kelas ini !!Bahannya sangat padat dan sulit untuk dilalui.Kuliah sangat membosankan, tetapi membantu dalam mengklarifikasi materi.Renzi sangat cerdas dan mengintimidasi bahwa sulit untuk mendekatinya.",Cukup Baik
112641,"Saya benar -benar membenci kelas ini!Materi itu menarik, tetapi kebijakan penilaian Renzi yang sangat sulit dan sikap mengintimidasi membuat saya takut pada kelas dan setiap penugasan.Saya menyelesaikan 95% dari bacaan, tetapi saya tidak pernah merasa nyaman atau siap.Juga, noda lubang besar!",Cukup Baik
112641,"Renzi adalah pria yang cukup pintar, tapi dia murah dan botak.Penari Helluva, anggun dan seperti Swan.Mereka harus memberinya kantor yang lebih baik.Mungkin unit sudut dengan beberapa panel mahoni &#63;Apa kesepakatan dengan latihan api sialan itu &#63;Tidak dapat belajar filosofi sambil digiring keluar dari gedung.",Sangat Baik
112641,"Renzi sangat cerdas dan menarik, tetapi dia membuat murid -muridnya yang paling cerdas kadang -kadang merasa bodoh.Sangat sulit untuk memproses apa yang dia inginkan dari Anda, sekarang peduli seberapa keras Anda bekerja.",Cukup Baik
112641,"Kadang -kadang membosankan, tetapi Renzi adalah orang yang sangat pintar dan dia memiliki kemampuan untuk membuat murid -muridnya memahami kompleksitas teks yang dia hadapi.Dia sama sekali bukan siswa kelas yang mudah, tetapi jika Anda tetap mengikuti bacaan Anda mungkin akan baik -baik saja.",Cukup Baik
112641,"Sangat cerdas.Sangat ketat.Perlakuan yang menarik untuk materi kursus dipotong oleh kebijakan kehadiran dan lamanya tugas membaca.Tantangan, jika Anda menyukai hal itu.",Baik
112641,"Materi itu menarik, dan begitu pula penilaiannya.Anda pikir Anda baik -baik saja dan kemudian berakhir dengan sesuatu yang kurang dari bintang.Saya pikir TA saya mencoba sedikit terlalu keras, tetapi pada saat yang sama dia bahkan tidak bisa menjelaskan topik kertas.",Cukup Baik
112641,"Bukan tidak mungkin untuk mendapatkan A, saya lakukan.Bahannya sangat menarik.Itu adalah kelas favorit saya dari kedua semester yang pernah ada di sini, dan saya bahkan bukan jurusan klasics atau filsafat.Renzi sangat cerdas, dan mengajar dengan baik.",Sangat Baik
112641,Kelasnya sangat menarik ... tetapi Anda tidak akan mendapatkan A tidak peduli seberapa keras Anda menghancurkan $$ Anda.Dia adalah Prof yang hebat.dan dosen tetapi verrrrrry sulit.Bawa saja dia jika Anda siap untuk tantangan yang sangat besar.,Cukup Baik
112641,Profesor Renzi adalah orang yang cerdas dan cerdas yang memiliki cara Sokrates yang menarik untuk mengintimidasi semua siswa di Conwest.Dia membuat kelas sangat sulit namun sangat menarik dan menarik dan membuka pikiran dan menyenangkan,Sangat Baik
112641,"Mmmm Renzi.Pasti tahu barang -barangnya, pasti memiliki banyak hal untuk diajarkan.Panas karena dia sangat pintar.",Cukup Baik
112641,Dia sangat pintar itu menakutkan.Penilaian jelas tidak adil.Sangat menarik meskipun memalukan untuk tidak mengambilnya tetapi Anda tidak akan mendapatkan a,Cukup Baik
112641,Sulit sekali ... tapi secara keseluruhan pengalaman belajar yang baik.,Baik
112641,"Kelasnya sangat sulit sebagai peta.Saya pikir dia adalah profesor yang luar biasa, tetapi memiliki kebijakan penilaian yang tidak adil, di mana Anda pikir Anda baik -baik saja sepanjang semester, dan kemudian melakukan dengan mengerikan di kelas akhir.",Cukup Baik
112641,"Dia sangat pintar di bidangnya, tapi terlalu sulit di kursus peta",Cukup Baik
112641,Terlalu banyak pekerjaan untuk kelas peta,Cukup Baik
112641,sangat kejam dan sombong,Cukup Baik
112641,"Kelas ini luar biasa, Anda hanya harus benar -benar bekerja untuk kelas.",Sangat Baik
112641,Tidak ada komentar,Sangat Baik
405301,Profesor yang sangat baik.Mengajar ekonomi tidak hanya berdasarkan buku teks.Kuliah merangsang.Tes tidak sulit jika Anda mau berpikir.Akan merekomendasikan.,Baik
405301,Saya tidak akan mengambilnya lagi!,Buruk
405301,"Meskipun saya bukan jurusan ekonomi, saya sangat menikmati kelas ini.Harry sangat jelas dalam penjelasannya dan tidak keberatan untuk mengulangi konsep yang tidak jelas.Sejujurnya, saya tidak menyukai sikapnya yang sombong.Struktur Kelas: Nilai akhir tidak melengkung, sehingga Anda lebih baik bekerja keras untuk A. Kelas ini didasarkan pada 3 ujian yang setiap pertanyaannya bernilai 1 poin.",Baik
