Id,Komentar,Rating
45881,"Rand adalah pria yang baik, sungguh ... dia.Tapi saya merasa dia memiliki alter-ego ketika dia pergi untuk pulang dan menilai.Harapannya dan bagaimana ia memilih surat -surat murid -muridnya tidak adil.Sekali lagi, pria yang hebat tapi hindari kelas ini dengannya !!!",Sangat Buruk
45881,"Dia brilian di bidangnya, tetapi mengharapkan murid -muridnya untuk tampil di tingkat tinggi, dengan harapan yang tidak realistis.Hanya dengan keajaiban saya mendapatkan A, dan itu setelah kurva yang berat.Dia peduli dengan murid -muridnya, karena dia memberikan banyak waktu di kelas untuk bekerja, sementara dia berkeliling memberikan tips dan menjawab pertanyaan.",Buruk
45881,"Dia memiliki jurusan filsafat itulah sebabnya semua makalah yang harus Anda tulis didasarkan pada filsafat.Selama makalah Anda setuju dengan apa yang menurutnya Anda akan mendapatkan nilai yang bagus.Kalau tidak, kelasnya membosankan dan dia berbicara selama satu jam tentang omong kosong tetapi wajib untuk hadir jika nilai Anda akan turun.",Sangat Buruk
45881,"Saya pikir kelasnya sangat sulit tetapi terlepas dari semua itu, saya menjadi penulis yang percaya diri.Orang -orang di sini mengatakan 'Anda hanya bisa mendapatkan C di atas kertas' salah.Saya mendapat A dan A B. Anda hanya harus berada di dalamnya untuk memenangkannya.Jika Anda ingin mendapatkan A, dapatkan guru yang berbeda.Jika Anda ingin belajar, pilih Rand.Dia membuat Eng.110 sepadan dengan sesuatu.",Baik
45881,"Baru -baru ini saya baru saja selesai mengambil Comp 110 dengan Rand dan itu adalah kelas tersulit dari semester mahasiswa baru saya.Dia menganggapnya terlalu serius untuk kelas 100 level.80% dari kelas adalah makalah sehingga Anda akan berpikir Anda mengontrol nilai yang Anda dapatkan, bukan?Salah.Dia akan memisahkan kertas Anda dan memberi Anda nilai yang buruk terlepas dari upaya Anda.Saya bekerja keras untuk C.",Buruk
45881,"Steven Rand adalah orang yang baik dan sangat menarik untuk mendengarnya berbicara.Saya selalu terinspirasi setelah kuliah.Namun, tidak pernah berharap untuk mendapatkan sesuatu yang lebih tinggi dari C. Anda bisa berpikir kertas Anda sempurna tetapi, ia akan merobeknya dalam hitungan detik.Ambil profesor yang berbeda jika Anda tidak ingin memasukkan 9 jam kerja ke dalam kertas yang Anda dapatkan dengan nilai 'rata -rata'.",Baik
45881,Kelas keras,Baik
45881,Dia menilai kelas 100 level seperti kami semua adalah jurusan bahasa Inggris di kelas 300 atau di atas.Tidak pernah lebih tinggi dari C di atas kertas.Saya pergi ke pusat penulisan untuk setiap makalah.Sangat tidak jelas dalam instruksi dan sulit untuk didekati dengan pertanyaan.Jangan ambil kelas darinya.,Sangat Buruk
45881,Siswa kelas tangguh di atas kertas pastikan Anda melakukan pekerjaan dan konsep.Nilai partisipasi menyelamatkan Anda dalam jangka panjang.Jangan lewatkan kelas dan lakukan pekerjaan Anda.Pergi ke pusat tutor banyak membantu,Buruk
45881,Jangan mengambil bahasa Inggris 110 dengan Rand.Saya tidak merasa lebih baik dalam menulis karena gaya penilaiannya yang membingungkan.,Buruk
45881,Intinya Rand perlu pensiun sebelum ia merusak IPK semua orang.Dia pikir dia tahu banyak tentang bahasa Inggris dan berpikir itu adalah tugasnya untuk membuat penugasan esai teka -teki yang tidak dibutuhkan.Dia menjawab pertanyaan dengan pertanyaan dan suka membicarakan sampah tentang guru bahasa Inggris sekolah menengah;Benci guru sekolah menengah secara ironis membuatnya seperti sekolah menengah.Fr,Sangat Buruk
45881,Dia hanya akan memberikan kertas Anda A C. Tidak masalah apakah itu baik atau tidak.Bekerja sangat keras jika Anda berencana untuk lewat.,Baik
45881,"Salah satu profesor terburuk di UND.Siswa kelas yang sangat keras dan berharap banyak di kelas 100 level.Berpikir bahwa surat -surat semua orang harus menjadi karya agung.Tidak peduli berapa lama saya menghabiskan di atas kertas, saya tidak bisa mendapatkan lebih tinggi dari C. Satu -satunya alasan saya mendapat B di kelas adalah karena saya tidak pernah melewatkan satu kelas.",Sangat Buruk
45881,"Kelas ini sangat tidak berguna.Saya berada di kelas saat ini (hanya karena diperlukan.) Kelas tidak memiliki relevansi dengan apa pun dalam kehidupan.Rand adalah ****, kelasnya sangat membosankan.Dia bisa membuat kelas jauh lebih baik dengan menulis makalah yang sebenarnya memiliki makna bagi mereka alih -alih apa yang dikatakan oleh beberapa filsuf.Bacaan buku teks itu sulit !!",Sangat Buruk
45881,Profesor yang mengerikan.Dia tidak percaya pada a.Berpikir bahwa guru lain terlalu mudah.Jawab pertanyaan Anda dengan pertanyaan lain yang tidak membantu Anda.Mengajarkan Anda materi yang tidak relevan yang tidak akan pernah Anda gunakan lagi.Profesor terburuk yang pernah saya miliki.,Sangat Buruk
45881,"Profesor terburuk yang pernah ada.Dia mengajukan pertanyaan pribadi kepada saya yang tidak nyaman, membuat saya merasa bodoh ketika saya mengajukan pertanyaan, dan secara keseluruhan mengecilkan hati saya.Jangan ambil bahasa Inggris 125 darinya.",Sangat Buruk
45881,"Saya menghadiri kursus penulisan bisnis dan teknisnya.Rand mempermalukan orang karena tidak memahami tugas ketika mereka bertanya.Sangat egois, kasar bagi mereka yang membutuhkan bantuan, pekerjaan yang sangat sulit, siswa kelas keras -bahkan pada mereka yang mengikuti arahan.Saya sangat merekomendasikan menunggu untuk mengambil kelas ini dari orang lain.Tidak layak kehilangan poin pada IPK Anda.",Sangat Buruk
45881,"Dia adalah siswa kelas yang sangat keras, tetapi dia bertingkat tentang peningkatan sepanjang semester, bukan pada seberapa besar Anda yang lebih besar (maksud saya dia jelas bertingkat seberapa baik seorang penulis, tetapi lebih pada seberapa banyak Anda berkembang).Saya belajar banyak darinya.Saya bahkan membawa saya kelas bahasa Inggris berikutnya dengannya.Pasti mengikuti kursusnya jika Anda bisa!",Sangat Baik
45881,"Profesor Steven Rand sangat tidak jelas dan nilai sangat sulit.Jika Anda berada di kelas bahasa Inggrisnya, jatuhkan jika Anda menginginkan sesuatu yang kurang dari C. Dia benci bahwa 'siswa dinilai terlalu mudah di sekolah menengah' jadi sebagai tanggapan terhadap hal itu, ia suka mengecewakan murid -muridnya.",Buruk
45881,"Dia mengerikan!Jika Anda segera menjatuhkannya!Dia jahat, dan siswa kelas yang sangat keras !!!!",Sangat Buruk
45881,Buruk sekali.Penilaian yang mengerikan.,Sangat Buruk
45881,Saya berharap saya bisa memberinya nol,Sangat Buruk
45881,Tidak bagus.,Buruk
45881,"Ini adalah kelas yang sulit.Saya berharap semua kelas kuliah seperti ini, tetapi karena sebagian besar tidak agak menyegarkan untuk memiliki seorang profesor mendorong saya sebanyak ini.Jika Anda bersedia melakukan pekerjaan untuk Tn. Rand, Anda akan mengulangi manfaatnya.Jika tidak, maka ambil kelas ini dari orang lain.",Sangat Baik
45881,"Dia adalah seorang profesor yang sulit diatur.Dia menilai bagaimana perasaannya.Tidak pernah ada jawaban yang benar, makalah selalu dapat menggunakan perbaikan.Saya tidak akan merekomendasikan dia kepada siapa pun yang menginginkan nilai di atas C, bahkan untuk mendapatkan bahwa Anda harus memasukkan waktu yang berlebihan ke dalam setiap kertas.",Buruk
45881,"Dia membingungkan dalam setiap aspek: dalam kuliah, dalam tugas dan dalam mengkritik.Tugasnya biasa -biasa saja dan tidak pernah berubah.Saya berharap untuk mengeksplorasi tulisan dan menjadi lebih baik.Dia adalah siswa kelas yang mustahil, terutama karena dia menilai bagaimana perasaannya tentang ide -ide Anda, bukan pada grammer atau konten.Sangat mengecewakan.",Buruk
45881,"Guru terburuk yang saya miliki di UND.Maaf saya tidak memiliki gelar PhD dalam bahasa Inggris.Gaya penilaiannya terlalu kasar untuk kelas 125.Tidak ada seorang pun di kelas saya yang memiliki A. Saya telah menghabiskan 3x lebih banyak untuk kelas ini daripada yang lain tetapi kelas ini adalah nilai terburuk saya.Jika memungkinkan, hindari guru ini!",Buruk
45881,Pengalaman terburuk dalam hidup saya.Mengharapkan terlalu banyak untuk kursus 100 level.Ambil kelas ini jika Anda ingin menghabiskan 15 jam di kertas tiga halaman dan masih mendapatkan C-.Kebijakan penilaian yang konyol.,Cukup Baik
45881,"Untuk sebanyak mungkin limbah Univ 101, dia melakukan pekerjaan yang baik untuk menjaga hal -hal menarik.Hindari Univ 101 sama sekali jika Anda bisa.",Baik
45881,"Harapannya tinggi untuk kelas 100 tingkat yang diperlukan, terutama karena sebagian besar yang mengambilnya bukan jurusan bahasa Inggris.Untuk kreditnya, dia cerdas dan memberikan umpan balik yang baik.Saya tidak akan merekomendasikan dia kepada mahasiswa baru.",Baik
45881,"Steven Rand hanya lelucon !!Dan sangat canggung secara sosial!Jangan ambil kelas ini kecuali Anda ingin gagal keluar dari perguruan tinggi!Dia memberi Anda arahan untuk sebuah kertas tetapi nilai pada apa pun yang ada di pikirannya hari itu, penilaiannya tidak masuk akal dan tidak ada yang pernah mendapatkan A di salah satu kelasnya .... jika Anda tidak percaya saya akan memberi tahu Anda ini.",Sangat Buruk
45881,"Saya berjuang melalui kelasnya.Pertama- Dia seorang pengacara, jadi dia akan menuntun Anda untuk membuat Anda berpikir satu hal tanpa benar-benar menjanjikan apa pun.Kedua- Dia akan memberi Anda sekitar 20 instruksi berbeda pada satu kertas dan dia akan menilai dengan perasaannya.Kelas bodoh, saya bekerja sangat keras dan mengelola B tetapi dia mengatakan kepada saya bahwa saya memiliki & quot; tulisan yang lemah. & Quot;Hindari dia!",Sangat Buruk
45881,"Hey bersikap baikYa, dia sulit dimengerti, dan siswa kelas yang sangat keras, tapi dia seorang guru dan setidaknya dia melakukan pekerjaannya (tentu saja, semua orang termasuk saya akan menyukai kelas yang lebih mudah dan lebih dapat dipahami) Jalankan saja, dia bersedia untuk tahan dengan banteng semua orang semua orang yang semua orang banteng semua orang semua orang semua orang semua orang semua orang semua orangBerharap bahwa ia membantu setidaknya satu siswa meningkatkan literatur.",Baik
45881,"Stevevn Rand adalah profesor terburuk mutlak yang pernah saya miliki.Dia tanpa diragukan lagi adalah guru tersulit yang dapat Anda ambil untuk kelas bahasa Inggris apa pun.Dia menilai sangat keras, dan tidak pada tingkat kelas 100.Juga Steven Rand adalah yang terbesar & quot; Creeper & quot;Dia membuat semua orang di sekitarnya merasa sangat tidak nyaman.",Buruk
45881,"Ini adalah kelas 100 level tersulit yang pernah ada.Tidak masalah jika Anda mendedikasikan hidup Anda untuk kelas ini, Anda masih tidak akan mendapatkan A!Ambillah semester lain atau dengan profesor yang berbeda.Arahnya tidak jelas.Dia bertentangan dengan semua yang dikatakan buku itu, tetapi memberitahu Anda untuk menggunakan buku itu.Dia membingungkan, siswa kelas yang keras, dan pria yang berbeda.Menjauhlah !!",Buruk
45881,"Saya saat ini berada di kelas ini.Saya mengambil ini, karena saya diberitahu bahwa itu seharusnya lebih mudah dari 120. Saya menyesal tetap berada di kelas ini dengan Rand sebagai profesor saya.Dia baik dan cukup pintar, tetapi penilaiannya konyol.Dia adalah siswa kelas tersulit yang pernah saya temui. Jangan membawanya, jika Anda mengambil kelas ini sebagai seorang jenderal pada dasarnya.MENDENGARKAN.",Cukup Baik
45881,"Saya mengambil 125 karena saya mendengar itu lebih mudah dari 120 kecuali Anda mendapatkan profesor tertentu.Nah ini profesor itu.Dia pria yang baik tetapi mengharapkan kesempurnaan dan tidak berhubungan dengan kenyataan.Kelasnya membosankan dan keras, dan buku ini mahal.Makalah pertama adalah 3-4 halaman, terakhir akan menjadi 15 dengan masing-masing di antara semakin besar.Tidak akan merekomendasikan dia.",Buruk
45881,"Sejauh ini, ini adalah pengalaman belajar terbaik yang saya miliki di UND.Dia adalah siswa kelas yang keras tetapi dia membantu dengan menandai kertas Anda dengan saran serius.Saya merasa bahwa banyak yang salah mengartikan tanda -tanda untuk serangan pribadi ketika dia hanya mencoba untuk membawa yang terbaik pada murid -muridnya.Keterampilan menulis saya telah meningkatkan seratus kali lipat.Saya akan merekomendasikan dia kepada siapa pun.",Sangat Baik
45881,"Saya seharusnya membaca komentar ini sebelum saya mengambil kelas ini.Sejauh ini, ini adalah guru yang lebih buruk yang saya miliki!Dia membuat Anda merasa bodoh dan mengharapkan banyak cara untuk kelas 100 level.Buat pantat saya untuk mendapatkan B di kursus!Jika Anda bisa, silakan beralih ke guru lain, Anda akan bersyukur Anda melakukannya !!Dia berharap semua orang adalah jurusan bahasa Inggris!",Sangat Buruk
45881,Saya menyarankan untuk tidak pernah membawanya ... Saya membaca komentar di sini tetapi pikir itu tidak akan terlalu buruk jadi tetap berada di ... langkah yang salah ... percayalah..setlah keluar dari kelas secepatnya ... instruksinya tidak pernah jelasDan dia membuat Anda menulis surat kabar itu kemudian mengubah tugasnya saran saya untuk kelompok penulis adalah hanya menulis banyak omong kosong karena Anda tetap akan menulis ulang,Sangat Buruk
45881,Tidak ada komentar,Sangat Buruk
45881,"guru yang mengerikan, saya harus pindah dari negara bagian saya sangat membenci orang ini",Sangat Buruk
45881,Dia adalah guru yang sangat tidak adil ... Saya sarankan untuk tidak membawanya!,Sangat Buruk
45881,MUSTAHIL!Jika masih mungkin untuk menjatuhkan kelas ini ... lakukanlah !!Tidak mungkin untuk mendapatkan di atas C. dan hanya mendapatkan C Anda harus bekerja keras!,Sangat Buruk
45881,"Saya pikir dia adalah pria yang hebat untuk hanya berbicara tentang musik, dan hal -hal menyenangkan di luar sekolah, tetapi dia tidak pernah menjawab pertanyaan yang Anda miliki, dan memberi seperti pasangan B di kelas sisanya ... Anda tahu ...",Buruk
45881,Apa yang bisa saya katakan tentang Rand .... Anda yang sangat membencinya harus beruntung bahwa Anda tidak harus bertahan dalam kelas lima hari seminggu selama enam minggu selama satu setengah jam setiap hari ....Anda harus merasa agak beruntung!,Sangat Buruk
45881,"Pria ini adalah iblis yang terperangkap dalam bentuk manusia.Saat ini jam 2:42 hari sebelum makalah terakhir ini dan saya ingin mencungkil mata saya.Jika saya bisa memberikan beberapa saran kepada siswa masa depan, saya akan merekomendasikan untuk jatuh pada saat yang secepat mungkin dan menghemat waktu sebelum hari jatuh atau bersiap untuk menghabiskan 8 jam menulis kertas untuk mendapatkan c-. Saya membencinya",Sangat Buruk
45881,Mustahil untuk mendapatkan di atas c- pada apapun !!!Dia memperlakukan Anda seperti Anda adalah karyawan dari program NASA sains roket atau sesuatu ...... pria yang baik tetapi sedikit tidak berhubungan dengan kenyataan,Buruk
45881,dia menyebalkan ... dan dia ingin kamu gagal dalam hidup ... menjauh .. jauh ...,Sangat Buruk
45881,"Tidak mungkin mendapatkan nilai yang bagus.Jika Anda mendapatkan B, selamat, saya pikir Anda adalah yang pertama.Dia adalah siswa kelas yang tidak adil.Saya pergi ke pusat penulisan ketika dia bekerja dan menyuruhnya melihat kertas saya, membuat semua perubahan yang dia perintahkan untuk saya lakukan dan masih pergi C. Saya menghabiskan terlalu banyak waktu di surat -suratnya.Jika Anda memilikinya, keluar sekarang !!!!!!",Sangat Buruk
45881,Tidak pernah mengerti apa yang diminta karena dia tidak pernah memberi tahu Anda apa yang benar -benar ingin Anda lakukan.Dia benar -benar ****.,Buruk
45881,mustahil untuk mendapatkan nilai yang bagus,Buruk
45881,Tidak ada komentar,Buruk
45881,"dia cukup tangguh, terlalu banyak mengharapkan",Baik
45881,"Dia mengharapkan banyak dari murid -muridnya, tetapi meluangkan waktu untuk mengenal semua orang.Saya sarankan pergi ke laboratorium penulis sebelum Anda meminta bantuannya .. dan dia cenderung juga menyarankan itu, atau bersiaplah untuk banyak tinta merah.",Cukup Baik
45881,Orang ini sulit seperti paku.Yang dia lakukan hanyalah di mana saya ketika saya meminta bantuan,Sangat Buruk
45881,Dia menyebalkan,Sangat Buruk
45881,Dia membenciku .... tidak pernah mengajari kita cara menulis,Sangat Buruk
45881,Guru konyol ... membunuhmu dengan detail bodoh,Buruk
601915,"Kursus ini sulit, tetapi bisa dilakukan.Tn. Farm akan membantu Anda, tetapi kunci dari kursus ini adalah menggunakan Pusat Pembelajaran Matematika.Dia adalah seorang profesor yang ingin melihat Anda lewat sehingga dia mencoba membantu sebanyak mungkin.",Baik
601915,"Setiap hari ada penugasan WebSign yang diberikan (sangat memakan waktu dan mereka tidak membantu Anda dalam ujian).Tiga ujian yang dia berikan sangat sulit!, Yang bisa saya katakan hanyalah latihan ... banyak.Saya mendapat F pada ujian pertama saya dan harus Ace sisanya untuk mendapatkan A secara keseluruhan.Terakhir, final akan menghancurkan Anda, gadis yang duduk di sebelah saya menangis selama itu.",Buruk
601915,"Tn. Farm adalah salah satu orang terbaik yang akan Anda temui.Tugas WebAssign akan dibagikan setiap hari setelah kelas untuk mempraktikkan masalah dan kuis biasanya muncul setiap hari di kelas.Lakukan banyak pertanyaan latihan untuk 3 tes jangka menengah.Untuk final ia membuat Anda memahami konsep -konsep alih -alih menghafal masalah.Masukkan pekerjaan, dapatkan A.",Baik
601915,"Tes sulit karena tidak pernah cocok dengan catatan dan kuliah.Pada tes akhir, kami harus mendapatkan 70% di atasnya atau kami tidak melewati semua yang menurut Anda akan mengikuti tes, tidak.Harapkan pekerjaan rumah 4 hari seminggu.Tidak akan merekomendasikan.",Sangat Buruk
601915,"Tn. Farm adalah guru matematika terbaik yang pernah saya miliki.Dia sangat lucu dan sangat bersemangat tentang apa yang dia lakukan.Ada kuis hampir setiap hari di kelas, tetapi ini bukan akhir dunia jika Anda melewatkannya.",Sangat Baik
601915,Ambil kelas ini dengan prof yang berbeda,Sangat Buruk
601915,Dia akan menjawab semua pertanyaan yang Anda miliki.Dan dia bersedia memberi murid -muridnya kesempatan kedua untuk berlalu karena HW.Random dalam kuis kelas itu mudah!,Baik
601915,Stuart adalah salah satu profesor terbaik yang pernah saya miliki.Sayangnya ini tidak diterjemahkan menjadi dirinya yang efektif.Persiapkan untuk banyak pekerjaan rumah dan kuis harian.,Buruk
601915,"Jika Anda mengikuti kelas dengan Stuart Farm, bersiaplah untuk menghabiskan banyak waktu di luar kelas untuk pekerjaan rumah, sering kali mengajar diri sendiri sayangnya.Juga, ada kuis di kelas hampir setiap hari, jadi pergi!Pekerjaan rumahnya menantang dan memakan waktu, tetapi tesnya jauh lebih mudah yang bagus.Dia bukan yang terbaik dalam menjelaskan materi, tapi oke.",Cukup Baik
601915,Guru yang mengerikan di sekitar.Pernahkah dia tahun pertama saya kuliah untuk matematika dan terjebak dengannya lagi tahun pertama saya dan tidak ada yang berubah .. dia bahkan mungkin menjadi lebih buruk ..,Buruk
601915,Orang yang baik tapi benar -benar menyebalkan mengajar matematika.Kelas ini seharusnya untuk siswa yang berada di bawah skor matematika rata -rata tetapi ia membuatnya sangat sulit.Saya buruk dalam matematika untuk memulai dan dia tidak membantu.Hindari dia dengan segala cara.,Sangat Buruk
601915,"Saya mengambil Matematika 92 dan 93 dalam satu semester, itu sangat cepat.Jika Anda melewatkan kelas mana pun, Anda akan berada di belakang untuk sementara waktu.Secara keseluruhan, dia adalah guru yang baik, saya pikir banyak orang tidak suka bergerak dengan kecepatan itu dan pada gilirannya tidak menyukainya.",Cukup Baik
601915,"Mengambil kelas ini untuk minat, juga merupakan kursus matematika pertama di perguruan tinggi.Sangat sulit untuk memulai, HW baru dan baru setiap kelas (WebAssign), bersiaplah untuk melakukannya, dengan pemahaman yang kuat.Kehadiran sangat penting.Tes sangat didasarkan pada penugasan kelas dan contoh kuliah.",Baik
601915,"Farm memiliki pekerjaan rumah hampir setiap malam, tetapi tidak ada yang tidak dapat dilakukan dengan cepat untuk sebagian besar.Tes terakhirnya menyumbang persentase paling banyak dari poin di kelas sehingga belajar adalah wajib jika Anda ingin lulus kelas ini.",Baik
601915,"Jika Anda tidak menunjukkan pekerjaan Anda atau menunjukkan bahwa Anda memeriksa ulang jawaban Anda, dia akan memberi Anda nol, bahkan jika Anda mendapatkan pertanyaan yang benar.Anda juga tidak dapat melewatkan karena dia dalam latihan kelas yang Anda tuju di akhir kelas.",Sangat Buruk
601915,Pria yang sangat baik.sangat bersedia membantu,Cukup Baik
601915,"Tn. Farm adalah pria terbaik yang pernah Anda temui.Konsepnya mudah dipikirkan.Selama Anda memperhatikan dan muncul, Anda akan baik -baik saja.",Baik
601915,"Agak unik tapi dia orang baik yang peduli.Muncul setiap hari untuk poin gratis.Kuis hampir setiap minggu (berubah menjadi kuis kelompok pada akhir semester).Tes sangat mirip dengan kuis.Pekerjaan rumah hampir setiap hari dan jauh lebih sulit daripada apa yang akan Anda lihat di kuis/tes meskipun jika Anda meminta ekstensi, Anda akan mendapatkannya setiap saat.Matematika!",Sangat Baik
601915,"Agak aneh, membuat lelucon klise sepanjang waktu tetapi salah satu profesor matematika yang lebih baik yang saya miliki.Dia bersemangat tentang subjek dan itu menunjukkan.Dia menghabiskan waktu ekstra untuk memastikan bahwa murid -muridnya memahami alasan di balik mengapa Anda melakukan langkah -langkah tertentu dan, bagi saya, itu sangat membantu dalam pemahaman saya.Direkomendasikan.",Baik
601915,"Kelas ini adalah sakit kepala raksasa.Sejauh ini, kami memiliki lebih dari 30 penugasan (hanya bernilai 20% dari kelas) yang masing -masing membutuhkan waktu untuk menyelesaikannya, karena Stuart menempatkan banyak masalah yang tidak pernah kami alami di kelas.Selain itu, kami memiliki kuis komprehensif mingguan yang tidak konsisten dalam kesulitan dan poin.Sederhananya, saya mengasihani siapa pun yang harus mengikuti kelas ini.",Buruk
601915,Saya tidak akan merekomendasikan profesor ini jika Anda tidak kuat dalam matematika.Anda harus berharap untuk mengerjakan pekerjaan rumah hampir setiap malam.Penugasan pekerjaan rumah baru setelah setiap kelas.Tidak memberikan ujian tradisional tetapi kuis mingguan untuk poin.Buku teks yang ditugaskan tidak banyak membantu.Pekerjaan rumah membutuhkan waktu berjam -jam untuk hanya menyelesaikan porsi kecil.,Cukup Baik
601915,"Stuart Farm, sejauh ini, telah menjadi profesor terburuk yang pernah saya miliki.Dia menilai dengan sangat keras sehingga hampir tidak mungkin untuk mendapatkan C. (pada satu titik saya memiliki 48%) (& im rata -rata siswa A/B) yang ia berikan pada kuis mingguan dan memberikan pekerjaan rumah waktu.Saya tidak akan merekomendasikan dia.",Buruk
601915,"Dia adalah guru terburuk yang saya miliki selama sepuluh tahun terakhir.Dia pergi ke laut dengan mencoba menjelaskan sesuatu, dan ketika dia menjelaskan banyak hal, itu tidak muncul pada tes atau kuis.Ada banyak siswa lain di kelas saya yang tidak tahu apa yang sedang terjadi.Jangan ambil kelasnya.Anda harus mengajari diri sendiri pelajarannya.",Buruk
601915,Stuart Farm adalah pria yang fantastis yang sangat mudah bergaul.Menyapa Anda dengan senyuman setiap hari dan senang melihat Anda setiap hari dan mencoba membuat kelas menyenangkan.Defenit memperkenalkan diri kepada -Nya.Dia membingungkan dalam menjelaskan konsep -konsepnya.Dia cenderung menjelaskan secara berlebihan di mana itu membingungkan.Dia adalah orang yang sangat terhormat.,Cukup Baik
601915,"Stuart Farm adalah pria yang baik dan peduli dengan murid -muridnya, tetapi itu tidak menghasilkan pengajaran yang efektif atau menjaga kelas tetap terlibat.Dia tampaknya tidak mengerti bahwa siswa yang menggunakan Math146 adalah yang paling tidak mungkin untuk mengangkat tangan di sana dan berkontribusi, dan Anda tidak dapat berdiskusi dengan 100 orang.Untuk nilai, tonton dia seperti elang dan kirimkan email kepadanya secepatnya.",Buruk
601915,"Tn. Farm adalah guru yang baik, tetapi tidak terlalu jelas tentang jenis pertanyaan yang perlu kita bahas.Pekerjaan rumah dan tugas di dalam kelas jauh lebih sulit daripada ujian yang sebenarnya.",Baik
601915,"Tn. Farm adalah pria yang baik dan mencoba membuat semua orang tertawa.Tetapi poin bijak saya memiliki A, karena kurva -nya, saya memiliki C. Dia tidak pernah menjelaskan apa pun dan jika Anda mengajukan pertanyaan kepadanya, dia sepertinya tidak pernah menjawabnya.Saya akan menghindari mengambil kelasnya, kecuali Anda ingin gagal.",Buruk
601915,"Profesor Farm adalah pria yang baik dan ingin Anda melakukannya dengan baik, tetapi dia sangat membingungkan.Hindari dia jika memungkinkan.Saya membawa Math93 bersamanya, dan meskipun itu matematika yang sangat sederhana, ia membuat jika entah bagaimana sulit.Saya tidak memiliki matematika sejak tahun pertama sekolah menengah saya, jadi saya harus mengambil ini.Penjelasannya membuat segalanya lebih sulit.Harus mengajar diri sendiri.",Cukup Baik
601915,"Kelasnya tidak terlalu buruk, tetapi dia berusaha sangat keras untuk mendapatkan perhatian murid -muridnya dengan memecahkan lelucon klise.Saya melewatkan kelas sebagian besar waktu, dan tidak terlalu ketinggalan.",Cukup Baik
601915,"Memberikan contoh -contoh mudah di kelas saat mengajar, lalu ketika datang ke Web menugaskan pekerjaan rumah itu hal -hal yang lebih sulit yang tidak pernah ia ajarkan, hanya mengajarkan contoh -contoh dasar dan mengharapkan Anda untuk mengambilnya dari sana sendiri.",Sangat Buruk
601915,"Buka tab baru, buka koneksi kampus dan ubah ke kelas Calc 147 yang berbeda dengan guru yang berbeda.SEKARANG.Percayalah pada saya dan semua orang di sini yang telah mengikuti kelas ini.Memberi saya beberapa nol tentang masalah tes karena tidak melakukan pertanyaan 'caranya' bahkan berpikir jawabannya benar.",Sangat Buruk
601915,"Tn. Farm tahu matematika dan dia ingin Anda belajar.Jangan berharap dia hanya memberi Anda jawabannya.Dia akan menjawab setiap dan setiap pertanyaan dan mengklarifikasi apa pun yang Anda butuhkan.Hadiri kelas, lakukan tugas dan Anda akan baik -baik saja.Memberikan 2 tes (masing -masing 10 pertanyaan) dan akhir (15 pertanyaan).Super Nice, kutu buku yang moto adalah 'matematika!'",Baik
