Id,Komentar,Rating
103621,"Kelasnya sulit, saya membayar banyak uang untuk kelas yang keras. Saya tidak menginginkan A. Pelajarannya yang mudah sangat membingungkan, itu memaksa saya untuk membaca buku di depannya, dan dengan melakukan itu saya belajar materi dengan sangat baik.Dari pengalaman saya dengan guru biologi lainnya, ia sama membingungkannya dengan yang lain.Saya akan merekomendasikan guru ini kepada orang yang benar -benar peduli.",Cukup Baik
103621,"Prof. Whaley adalah guru yang sangat sulit.Saya bahkan mendengar salah satu yang paling sulit di barat, dan sangat mudah dipercaya.Ini adalah kursus yang sulit, tidak diragukan lagi, dia mengharapkan Anda untuk belajar sekitar 2 jam per jam waktu kelas, dan Anda akan membutuhkan setiap menitnya!Dia sulit tapi bagus.Sebagian besar siswa yang bekerja dengan baik di kelasnya berjalan dengan baik di MCATS '.",Cukup Baik
103621,"Banyak yang harus diuraikan, tidak bisa masuk dan kemudian terburu -buru untuk mendapatkan tes terperangkap kadang -kadang rumit tetapi adil.Tidak bisa mengeluh dengan a-",Baik
103621,Saya tidak benar -benar melihat sesuatu yang buruk tentang dia.Saya tidak berpikir kelasnya sulit.Tesnya memiliki beberapa pertanyaan rumit tetapi saya memiliki tes yang jauh lebih sulit daripada miliknya.Dia selalu bersedia membantu Anda dengan apa pun yang tidak Anda mengerti dan menghibur.Kesalahan besarnya adalah dia sedikit tidak terorganisir.,Baik
103621,Tesnya sangat sulit.Saya belajar seperti orang gila dan saya masih gagal kelas ini.Saya tidak benar -benar pergi ke kelas karena saya tidak mengerti apa -apa yang dia ajarkan karena dia melewatinya begitu cepat.Dia hanya mengatakan membacanya dan kemudian Anda akan memahaminya.Saya tidak akan merekomendasikan dia.,Sangat Buruk
103621,"Dia harus menjadi salah satu guru terburuk yang pernah ada.Hari pertama di kelas dia mengatakan bahwa jika Anda ingin melakukannya dengan baik pada tesnya, Anda harus mempelajari teks dan CD yang menyertainya.Saya menganggap itu berarti, & quot; Saya seorang guru yang buruk dan tidak akan mengajari Anda hal sehingga Anda sendiri. & Quot;Saya benar.",Sangat Buruk
103621,"Profesor Whaley sangat senang di dimuse murid -muridnya.Tes tentang genetika sangat sulit dipercaya dan menyiksa sehingga saya mempertimbangkan untuk mengirim surat kebencian ke Dr. Whaley.Hampir karena dia ingin kita belajar gagal, daripada belajar biologi untuk menjadi mahasiswa kedokteran.Sangat tidak puas dengan kemampuan mengajarnya.",Sangat Buruk
103621,"Whaley lebih peduli tentang menutupi materi daripada membantu para studetnya untuk memahami dan belajar.Dia tidak menjawab pertanyaan siswa dengan cara yang jelas, alih -alih hanya menyatakan kembali apa yang dia katakan pertama kali (yang menyebabkan kebingungan di tempat pertama) tampaknya hampir bahwa dia ingin murid -muridnya gagal daripada berhasil.Dia adalah seorang profesor yang mengerikan",Sangat Buruk
103621,"Guru yang sangat buruk ... sombong, kekanak -kanakan, egois, tidak jelas.Dia benar -benar membuat orang di kelas saya merasa buruk/bodoh karena mengajukan pertanyaan - mereka tidak akan mengajukan pertanyaan lagi setelah itu.Saya mendapat A, Anda bisa jika teks itu menjadi teman terbaik Anda dan Anda bersedia tahan dengan dork/brengsek untuk seorang guru dan & quot; lompat melalui lingkarannya. & quot;",Buruk
103621,"Guru terburuk di UVSC.Saya memiliki beberapa yang buruk, tetapi dia benar -benar tidak peduli membantu murid -muridnya.Saya melihat terlalu banyak anak miskin terkoyak baru karena menanyakan sesuatu di kelas.Hindari yang satu ini jika Anda ingin mendapatkan apa yang Anda bayar dengan uang sekolah Anda.",Sangat Buruk
103621,"Secara pribadi saya suka Whaley dan metode pengajarannya.Dia memang membuat Anda bekerja keras untuk nilai Anda - saya mengambil 14 kredit dan mempelajari sekitar 50% dari waktu untuk kelasnya.Saya mendapat B di kelasnya dan A di semua kelas saya yang lain.Kabar baiknya adalah, dia benar -benar mengajari Anda segalanya secara detail.",Baik
103621,Tidak ada komentar,Sangat Buruk
103621,"Guru ini menyebalkan waktu yang besar.Dia mungkin guru terburuk yang pernah saya miliki.Seperti yang dikatakan orang lain, akan lebih mudah bagi Anda untuk membaca buku dan melakukannya sendiri.Dia sangat mudah.",Sangat Buruk
103621,"Banyak orang mengatakan kepada saya bahwa mereka menyesal untuk saya ketika saya memberi tahu mereka bahwa saya memiliki whaley untuk bio.Saya tidak mengerti mengapa saya pikir dia adil dan mengajar di tingkat yang seharusnya.Dia selalu bertanya apakah ada yang punya pertanyaan.Metode pengajaran yang agak panik, tetapi menghibur.Saya akan membawanya lagi.",Baik
103621,"Whaley adalah profesor yang baik.Saya memiliki waktu yang indah di kelasnya.Dia membantu saya memahami bio.Jika Anda ingin mempelajari sesuatu, ambil kelasnya.",Baik
103621,Guru yang baik.Benar -benar tahu barang -barangnya.Benar -benar ingin Anda belajar.,Sangat Baik
103621,"Saya sangat menikmati kelas Dr. Whaley.Cara mengajarnya membuat Anda tertarik pada subjek ini.Dia benar -benar peduli dengan murid -muridnya dan ingin mereka belajar sebanyak mungkin.Dia menikmati kupu -kupu dan jika Anda bisa membuatnya membicarakannya, itu layak untuk Anda sementara.Pria yang hebat.",Sangat Baik
103621,"Guru yang sangat baik.Tolong abaikan komentar yang dibuat oleh orang -orang yang mungkin tidak boleh dalam kursus biologi apa pun.Kelasnya sulit, tetapi seharusnya.Saya senang saya bisa membawanya.",Sangat Baik
103621,Whaley hanya memiliki satu tipis di benaknya ... Swallowtail Butterfies.Dia adalah otoritas terkemuka di dunia tentang masalah ini.Tetapi dia memiliki sangat sedikit waktu atau kesabaran untuk siswa biologi tahun pertama.Dia tidak tertarik untuk memastikan Anda memahami materi (sangat tidak terorganisir) dan Surga membantu Anda jika Anda mengajukan pertanyaan di kelasnya.Caveat emptor !!!,Sangat Buruk
103621,"Saya belajar berjam -jam dan saya masih keluar dengan nilai yang mengerikan.Saya pergi ke kelas setiap kali dan menggunakan setiap metode studi yang bisa saya pikirkan.Jika Anda bukan seorang jenius, jangan berharap mendapatkan nilai yang baik di kelas ini.",Sangat Buruk
103621,"Ini adalah kelas yang keras, di atas ada Matematika 1050. Saya membaca buku dan datang ke kelas dan belajar, saya melakukannya dengan baik.Tidak peduli siapa yang Anda ambil kelas ini darinya akan sulit",Baik
103621,Pernah melihat film Waynes World &#63;Skitter berotak dan separuh waktu dia tidak tahu apa yang dia bicarakan.Buku teks yang ia gunakan menyebalkan.Ambil kelas ini dari sekolah lain.Saya berharap Bybee Thaught Kelas ini.Lab adalah lelucon!Ini mengingatkan saya pada proyek sains sekolah menengah.,Sangat Buruk
103621,Whaley adalah guru yang hebat.Sangat jelas dan bermanfaat bagi siswa bio namun dia tangguh dalam tesnya.,Sangat Baik
103621,"Tidak terorganisir, apatis, dan pada dasarnya tampaknya tidak menikmati atau memahami cara mengajar kelas sama sekali.Sekolah seharusnya hanya mempekerjakannya untuk melakukan penelitian karena dia tidak memenuhi syarat untuk mengajar",Sangat Buruk
103621,Tidak terlalu bagus.Saya tidak akan merekomendasikan membawanya.,Sangat Buruk
103621,Saya pikir dia adalah guru yang hebat!,Sangat Baik
103621,"Hindari orang ini, dia bodoh.Semua orang yang mengatakan & quot; Anda hanya perlu membaca buku dan Anda akan baik -baik saja & quot;Benar, tapi itu selalu terjadi di setiap kelas.Temukan guru yang berbeda yang benar -benar dapat mengajari Anda sesuatu.",Sangat Buruk
103621,Anda pasti memiliki teman kelas yang merindukan.Tidak ada kuliahnya yang ada hubungannya dengan tes dan kami juga tidak pernah menjalani tes.Anda benar tentang tes yang berasal dari buku tetapi tidak sejelas yang dipikirkan orang.Ambil kelas ini di tempat lain sebelum datang,Sangat Buruk
103621,"Saya pikir kelas Dr. Whaleys sangat informatif.Mereka yang mengeluh mungkin tidak pernah membaca teks mereka, ujiannya adalah refleksi langsung dari teks.Lakukan bagian Anda dan Anda akan baik -baik saja.Direkomendasikan.",Baik
103621,Sungguh bodoh!Saya tidak tahu di mana orang ini memperoleh gelarnya tetapi dia tidak bisa mengajar.Waspadalah bio di u atau y sebelum datang ke sini.Guru ini menyebalkan!,Buruk
103621,"Sang scatter!Ambil Chem sebelum kelasnya, Anda harus memperbaikinya berkali -kali.Jangan merekomendasikan dia!Tidak bisa mengajar, tidak menguji apa yang dia ajarkan, sebagian besar waktu kelas tidak ada topik.Tidak ada gunanya menghadiri kelas!Saya memperoleh semua pengetahuan saya dari buku ini.",Sangat Buruk
103621,Anda semua adalah sekelompok ****.Dia seorang guru yang baik setidaknya Anda tahu apa yang akan dia uji sebelum setiap tes.,Sangat Baik
103621,"Sayangnya dia adalah satu -satunya guru untuk 2110!Dia adalah guru yang mengerikan.Pria yang baik, tapi tidak tahu cara mengajar.Pastikan untuk memiliki setidaknya beberapa latar belakang chemistry karena ketika dia masuk ke dalam bahwa murid -muridnya harus memperbaikinya sering kali!",Cukup Baik
103621,"Jika Anda tidak keberatan dengan garis singgung, silakan.Ketahuilah bahwa jika Anda mengajukan terlalu banyak pertanyaan tentang masalah sampingan, Anda baru saja kehilangan kuliah hari itu.",Baik
103621,"Guru yang baik, sedikit tidak menentu dengan pikiran satu jalur.Jangan pedulikan ludah.",Baik
103621,"Mudah, tetapi Anda harus membaca buku Anda!",Cukup Baik
1307460,Saya tidak akan pernah mengikuti kelas ini-terutama online.Saya belum pernah melihat seseorang yang tidak akan pernah berkomunikasi dengan murid -muridnya.Saya mencoba menghubunginya beberapa kali dan saya menyerah.Saya tidak keberatan tentang banyak pekerjaan rumah atau apa pun tetapi dia adalah salah satu profesor terburuk yang pernah saya temui sepanjang hidup saya.,Sangat Buruk
1307460,"Saya tidak akan merekomendasikan mengikuti kursus ini secara online.Guru memiliki kursus yang sangat terstruktur dan terorganisir.Serta sekelompok kuliah yang membawanya beberapa waktu untuk dibuat, jadi alat peraga kepadanya.Namun, tesnya sangat sulit dimengerti.Jika Anda mengikuti kelas studi studi ini.Pergi ke segala hal.Terutama bagian kimia ...",Buruk
1307460,"Mengambil online.Saya benci pertanyaan triknya kuis dan tes.Saya mendapat kebanyakan 100% tetapi saya harus duduk di sana selama berjam -jam dan menganalisis.Dia menggunakan vocab mewah dalam kuliahnya tanpa mendefinisikan kata -kata jargonnya.Dia tidak berkomunikasi sama sekali dengan Anda melalui email dan semacamnya, bahkan jika Anda menggunakan kanvas.Tautannya untuk mempelajari lebih lanjut tentang konsep tidak pernah bekerja.",Cukup Baik
1307460,Saya tidak akan merekomendasikan mengambil kelas ini secara online.Sangat sulit bagi saya untuk memahami kuliah.Dia mengharuskan murid -muridnya untuk mengikuti ujian akhir di Pusat Pengujian UVU sehingga Anda benar -benar perlu tahu apa yang sedang terjadi di kelas jika Anda ingin mendapatkan nilai yang baik pada ujian.Untuk saat ini saya akan mengambil kelas sains saya secara langsung.,Buruk
1307460,Bersiaplah untuk menghabiskan setengah semester membelai ego Charles Darwin hanya untuk tidak memiliki pertanyaan tentang dia di final.Kelas ini sangat terstruktur dan setelah mempelajari semua materi online yang dapat saya temukan untuk final Bio 1010 saya berjalan keluar dari uji yang dibutakan oleh 3000 pertanyaan level.Belum lagi dia tidak pernah menanggapi email.,Sangat Buruk
1307460,"Jika Anda cukup sial untuk mendapatkan kursus ini, dapatkan buku teks opsional.Model pengajarannya buruk, dengan tugas membaca yang sangat panjang, dan 3 pertanyaan pertanyaan atas materi (kuis adalah 25% dari nilai akhir).Buku teks membantu memadatkan & menjelaskan materi.Beberapa materi kuis tidak tercakup dalam video online.Buku teks membantu.",Sangat Buruk
1307460,"Tesnya sangat sulit.Saya akan belajar keras untuk mereka, mengunjunginya untuk mengajukan pertanyaan tambahan, dan masih akan mendapatkan C dalam tesnya.Ini adalah cerita yang sama dari teman sekelas saya yang lain.Dia adalah pria yang baik dan Anda akan belajar banyak.Tetapi Anda mungkin berjuang menjaga kepala Anda di atas air selama semester pertimbangkan untuk mengambil Profesor Bayer- Pilih Kehidupan!",Cukup Baik
1307460,"Tidak ada buku, hanya situs web acak yang ia berikan untuk Anda baca.Alih -alih mendasarkan tes pada informasi dari situs web, tes didasarkan dari buku teks biologi yang tidak kami gunakan.Karena itu, tesnya sangat sulit dipelajari.Juga, final sangat sulit (tidak ada panduan belajar).Rata -rata kelas adalah 51/110.",Sangat Buruk
1307460,"Dr Parker cukup baik dan ingin membantu.Dia akan menjawab pertanyaan yang Anda tanyakan di dalam dan sesudah kelas.Kelas berasal dari tes, tetapi ujian terendah dijatuhkan dan diganti dengan skor kuis 10 teratas yang bermanfaat.Tesnya sulit.Mereka dimaksudkan untuk menipu Anda.Pertanyaan super ambigu yang membuat Anda menebak bahkan ketika Anda mengetahui materi.",Buruk
1307460,"Saya tidak punya apa -apa untuk dikatakan tentang Profesor Parker.Seperti yang dikatakan orang lain, dia tidak ada hubungannya dengan kursus.Untuk menguraikan hal itu, tidak ada ujiannya yang cocok dengan materi kursus yang ia gunakan (tetapi tidak membuat), dan ujian akhir sebagian besar pertanyaan kimia, yang tidak cocok dengan materi kursus yang dicuri atau ujian menengahnya.",Sangat Buruk
1307460,"Kelas yang benar -benar konyol.Menggunakan material dan kuliah dari profesor yang berbeda, tes adalah sewenang -wenang dan tidak mungkin untuk dipelajari, final sangat berat pada satu bagian material, dan, sekali lagi, tidak mungkin untuk dipelajari.Ya, saya lewat.Ya, saya mendapat nilai yang layak.Tapi kelas ini terlalu sakit kepala.Jangan ambil dari profesor ini!",Sangat Buruk
1307460,Materi ini disalin dari kursus berusia tiga tahun yang bahkan tidak ia buat dan kemudian menguji kami pada materi bukan dari kuliah online (pikirkan biol 3000+ materi).Tugas tertulis dinilai oleh TA sehingga dia bahkan tidak melakukan penilaian sendiri untuk pekerjaan apa pun.Mengapa saya harus repot -repot berupaya di kelas ketika guru saya tidak?,Sangat Buruk
1307460,Dia bahkan tidak mengajar kelas yang dia kumpulkan.Ini adalah kursus 3 tahun dari Prof. lain yang tampaknya tidak memahami sistem online.Jumlah bacaan yang luar biasa yang ditugaskan dalam waktu yang sangat singkat.Tes mencakup detail paling kecil.Ini bukan Biologi 1010. Ini adalah kelas level 3000.Jangan mengambil kecuali Anda benar -benar tidak punya pilihan.,Sangat Buruk
1307460,"Saya tidak tahu di mana dia mendapatkan materi untuk semuanya, tetapi kuis, tes, dan ujian semuanya tampaknya memiliki informasi yang berbeda.Saya akan mendapatkan 100% pada kuis dan tes, dan kemudian masuk ke ujian dan keluar dengan 50% merasa seperti itu semua informasi baru.Dia pada dasarnya baru saja membacakan pertunjukan slide yang telah dia persiapkan.Itu adalah kelas yang membingungkan.",Sangat Buruk
1307460,"Sepertinya dia ingin Anda belajar bio, tetapi tidak ingin Anda melakukannya dengan baik di kelas.Pelajaran bersifat umum tetapi tes spesifik dan mencakup hal -hal yang tidak dibahas di kelas, mereka sarat dengan pertanyaan trik.Jika Anda seorang jurusan bio yang mencari tantangan maka dia hebat, tetapi jika Anda hanya ingin mendapatkan kredit bio ge 3cr Anda maka ada lebih mudah",Cukup Baik
1307460,"Beban kerja di kelas ini konyol.Anda dapat dengan mudah menghabiskan 2 hingga 4 jam per hari hanya mencoba mengikuti kelas ini.Kuisnya sangat sulit, ujiannya bahkan lebih buruk.Jika Anda mengambil kembali kuis, rangkaian pertanyaan kedua selalu lebih sulit daripada yang pertama.Saya tidak akan merekomendasikan siapa pun yang mengambil kelas ini darinya.Seharusnya aku melihat.",Sangat Buruk
1307460,Kuis dan tes tidak didasarkan pada kuliah atau membaca ... satu -satunya informasi bermanfaat yang saya temukan untuk kelas ini adalah quizlet ... belajar untuk ujian menggunakan quizlet dan Anda akan mencetak akan ... jika Anda benar -benar melakukan pekerjaan yang diharapkan untukDitegani dalam ujian ...,Sangat Buruk
1307460,"Saya mengambil kursus ini secara online setelah mendapatkan C+ tahun yang lalu di kampus utama.Saya berakhir dengan nilai huruf lebih rendah untuk kedua kalinya.Kursus online dapat dilakukan jika Anda akan menyisihkan waktu untuk belajar.Sangat mudah untuk melakukan tugas tetapi tes lebih sulit.Jika Anda bukan pengambil tes yang baik, kelas ini bukan untuk Anda, ujian akhir sulit!",Cukup Baik
1307460,Ini adalah kesempatan saya untuk merebut kembali biologi (saya lulus beberapa tahun yang lalu dengan c) Saya pikir ini akan menjadi kesempatan yang mudah karena saya berada di tahun ketiga dan tahu barang -barang saya.Tidak begitu !!Materi itu jauh lebih sulit dari yang diperlukan dan saya tidak belajar apa pun.Tidak membiarkan Anda kembali untuk memeriksa jawaban di kuis dan semuanya ada di situs web dan video panjang 2 jam di Darwin.,Sangat Buruk
1307460,Bukan pengajaran berbasis buku.Semua hal yang diharapkan untuk dipelajari adalah dari situs web.,Sangat Buruk
1307460,"Guru yang sangat hebat.Saya tidak mengerti semua peringkat negatif.Setiap kali saya memiliki pertanyaan, dia akan tinggal setelah saya untuk membantu saya memahaminya.Jika Anda pergi, membuat catatan Anda, dll. Anda harus mendapatkan A, ia mencoba membuat semua orang mendapatkan A. Kuliah panjang tetapi ia membuatnya menyenangkan.Benar -benar jangan malas.Pria yang hebat, guru yang hebat, kelas yang hebat.",Sangat Baik
1307460,Tesnya mengerikan!Dia menulis tesnya sendiri tetapi dia tidak boleh.sangat buruk!Trik pertanyaan yang berlimpah!,Sangat Buruk
1307460,Kelas ini berada di ruang kuliah sehingga tidak terlalu menarik.Dia melakukan pekerjaan dengan baik.Itu adalah ulasan yang bagus jika Anda sudah tahu sesuatu tentang biologi.,Baik
1307460,Jangan ambil.Parker adalah guru yang sulit.Dia tidak bekerja dengan baik dengan para siswa.Tes itu sulit.,Sangat Buruk
1307460,"Pertanyaan tes cenderung menjadi pertanyaan trik;Dia hanya berusaha membuat orang menjadi pengambil tes yang lebih baik dan membaca setiap pertanyaan secara menyeluruh.Saya pribadi berpikir kuis clicker di kelas adalah yang paling sulit.Tapi itu bagus, karena dia menjatuhkan 5 tugas terendah, kuis, dan tes terendah.Dia pandai menjelaskan sesuatu.",Baik
1307460,Hindari hindari !!!!!!Dia memperlakukan Anda seperti Anda adalah makhluk yang lebih rendah dan mengharapkan Anda untuk lulus kuis 30 menit waktu bahwa dia beberapa minggu lagi dari menutupi materi dan konten kuis hampir tidak ada pada slide -nya dan pembacaan bab masing -masing sekitar 100 halaman dengan cetakan halus.Semoga berhasil mencoba menemukan jawabannya sendiri.,Sangat Buruk
1307460,"Profesor Parker membuat banyak perbandingan dengan hal -hal sehari -hari, yang bisa sedikit membingungkan.Saya pada dasarnya mengajar diri saya sendiri biologi dan kami memiliki kuis sepanjang waktu tentang materi yang belum pernah kami liput.Ini bukan kelas yang sulit, tetapi bisa sangat menegangkan dan tidak nyaman.",Cukup Baik
1307460,"Dia guru yang baik dan menjelaskan hal -hal dengan baik.Dia mencoba untuk menjadi lucu (biasanya tidak), tetapi setidaknya mencoba membuat kelas relatif menarik.Namun, saya tidak akan merekomendasikan mengambil kelas karena dia menguji Anda pada materi yang belum dia ajarkan.Pelajarannya sekitar 2 minggu di belakang tes dan kuis sehingga Anda diharuskan mengajar diri sendiri.",Cukup Baik
1307460,"Saya tidak akan berbohong, ini adalah kelas yang sulit.Anda harus tahu banyak!Tapi Profesor Parker adalah guru yang baik.Dia benar -benar lucu dan sangat baik dan bermanfaat saat Anda memiliki pertanyaan.Anda tidak akan memerlukan buku teks selain untuk tugas belajar yang ia buat Anda lakukan.Semua tesnya didasarkan dari powerpoint dan ujian lama, jadi catat!",Cukup Baik
1307460,"Profesor Parker mengerikan.Saya benar -benar bingung sepanjang semester dan ketika Anda mengajukan pertanyaan, dia membuat Anda merasa sangat bodoh.Saya tidak akan merekomendasikan Profesor Parker kepada siapa pun.Tes sangat sulit dan ketika Anda bertanya bab apa dalam buku teks yang diliput, ia mengatakan semuanya.",Sangat Buruk
1307460,"Parker adalah guru yang hebat.Dia sedikit aneh tetapi memberikan metafora yang menarik dan relevan untuk membantu Anda dengan konsep.Berbasis Kuliah-Saya bahkan tidak membeli buku teks.Nilai adalah 100% kuis dan tes, yang sebenarnya saya sukai.Catat dan Anda akan melakukannya dengan baik.Banyak peringkat negatif mengejutkan saya;Saya pasti akan merekomendasikan dia.",Baik
1307460,"Kelas ini sama sekali tidak seburuk yang dikatakan semua orang.Parker sebenarnya adalah instruktur yang sangat baik;Saya belajar dengan sangat baik darinya.Tes sulit, tetapi dia memberi Anda banyak materi untuk membantu Anda berhasil, termasuk rekaman kuliah dan slide titik daya.Jangan takut semua komentar negatif di sini, saya sangat menyukai Dr. Parker!",Baik
1307460,Saya tidak menyadari sampai sekarang bahwa saya akhirnya mendapatkan B+ di kelas & saya tidak tahu bagaimana itu terjadi karena saya hanya lulus satu tes sepanjang semester.Dia berjalan dan berkeringat dan mengoceh seluruh kelas.Dia mengingatkan saya pada Kevin dari kantor: membosankan.Dia hanya memberi kuliah dan hanya memiliki ujian sehingga Anda perlu mempelajari semuanya di kelas.Jangan merekomendasikan.,Sangat Buruk
1307460,"Kelas ini tidak mudah.Jika Anda mengikuti tujuan kursus dan menggunakan ujian latihan lama (secara luas), Anda akan melakukan nilai yang baik.Banyak yang harus diambil, terutama untuk seseorang yang tidak mengambil jurusan sains sama sekali.",Cukup Baik
1307460,"Saya benar -benar menikmati kelas ini.Parker tangguh, tapi itulah yang membantu saya mempelajari materi.Dia membahas semuanya dengan sangat baik dan dia menghabiskan banyak waktu untuk menjawab pertanyaan.Dia sekarang merekam kuliahnya, memberi Anda semua slide -nya, dan memberi Anda beberapa bahan hebat untuk belajar untuk ujiannya.Dia lebih baik dari yang dikatakan orang",Baik
1307460,"Guru terburuk yang pernah ada!Saya sekarang telah mengambil kelas ini dua kali dan telah melewati kedua kali, tetapi tidak dengan nilai yang sangat baik.Nilai Anda ditimbang oleh ujian dan kuis, yang hampir tidak mungkin dipahami.Seorang teman saya mengambil biologi di BYU melihat salah satu kuis saya dan mengatakan bahwa itu lebih sulit daripada tes yang baru -baru ini dia ikuti hari itu.",Sangat Buruk
1307460,"Sejauh ini guru terburuk yang pernah saya temui.Pergi kepadanya beberapa kali dan meminta bantuan karena saya sedang berjuang dan dia hanya mengatakan kepada saya untuk 'melakukan lebih baik.'Uji Anda tentang hal -hal yang belum Anda bahas, mengoceh tentang apa pun, tidak ada pekerjaan rumah untuk membantu nilai Anda, dan tidak peduli seberapa keras Anda mempelajari materi, selalu berbeda dalam tes.Mengerikan.",Sangat Buruk
1307460,"Tidak menanggapi email, mengoceh tentang tidak ada yang berguna selama kelas, tidak mengikuti garis besar bab buku teks, nilai hanya didasarkan pada ujian dan beberapa kuis - tidak ada pekerjaan rumah untuk menilai atau membantu memahami konsep.Tidak lain adalah penyebab stres.Kelas ini adalah alasan saya tidak lagi memiliki beasiswa.Saya bahkan punya tutor.",Sangat Buruk
1307460,"Yang harus Anda lakukan adalah pergi ke kelas dan mendengarkan dan Anda akan lulus.Saya mendapat B, jika saya belajar atau melakukan kuis yang akan saya lakukan dalam jangkauan.Tes ada untuk membuat Anda berpikir dan memahami konsepnya tidak memastikan Anda dapat menghafal.Gunakan tes latihan dan Anda akan mendapat skor dengan baik pada tes.",Baik
1307460,"Jangan berharap untuk lulus kelasnya.Dia bukan guru yang baik.Dia berada di CHPTR 10 tetapi, semua HMW yang harus dilakukan adalah online dan mereka pada CHPTR 13. Dia tidak akan MOV Tanggal.Tesnya tidak masuk akal.Mengatakan tesnya hanya pada barang -barang yang tertutup kelas & tidak.Tidak ada yang ada di nilai Anda selain ujian.Tidak ada pekerjaan rumah tidak ada kehadiran hanya tes.",Buruk
1307460,"Guru yang mengerikan untuk berkomunikasi.Mengirim email, pesan kanvas, dan tidak pernah ada tanggapan !!Bagaimana seorang siswa seharusnya berkomunikasi dengan profesor ketika dia sakit.Kuliahnya sulit dan dan format tes membingungkan.Satu -satunya hal yang baik tentang kelasnya adalah ia merekam kuliahnya.",Buruk
1307460,"Profesor Parker sangat keras tetapi dia mengajarkan semua yang Anda butuhkan di kelas.Dia mengharapkan Anda untuk mengetahui segalanya dari kelasnya.Terkadang membingungkan tetapi pergi kepadanya dan dia akan menjernihkannya.Untuk A: Pergi ke kelas, listen ulang kuliahnya sampai Anda tahu persis apa yang dia katakan dan bagaimana dia mengatakannya.Tes berasal dari 80%lect saat ini 10%melewati lect 10%1610 buku",Sangat Baik
1307460,kelas yang mengerikan.Tidak ada interaksi kelas yang hanya memberi kuliah sepanjang waktu.Dia melakukan garis singgung sepanjang waktu tetapi masih mengharapkan Anda untuk mengetahui segalanya.Panduan studinya sama sekali tidak seperti tesnya dan dia memiliki banyak pekerjaan untuk Anda lakukan.Dia memperlakukan Anda semua seperti Anda sudah tahu segalanya.Hampir tidak mungkin lulus kelasnya.,Sangat Buruk
1307460,"Jangan menerimanya.Tes rumit.Tidak ada HW untuk bantalan nilai Anda.Dia mengambil 10 nilai kuis terbaik Anda untuk mengganti nilai uji, tetapi bahkan itu tidak membantu.Saya memiliki profesor biologi lain mengajari saya dan dia mengatakan materi yang dia ajarkan harus di kelas bio canggih dan dia tidak memahami pertanyaannya.Hindari dia.",Sangat Buruk
1307460,"Parker sepertinya dia ingin Anda belajar tetapi pertanyaan tesnya bisa sulit.Jangan lewatkan kelas dan ketika Anda belajar untuk tes, tekankan detail yang dibahas di kelas dan di powerpoints.Nilai Anda tampaknya akan rendah karena nilai tes Anda tetapi jika Anda melakukannya dengan baik pada kuis, nilai Anda akan lebih baik dari yang diharapkan.Semoga beruntung.",Buruk
